name,description,current_price,active,category
BodyEra Performance Tee,Lightweight moisture-wicking training shirt designed for gym sessions and everyday wear.,34.99,true,T-Shirts
BodyEra Core Training Tee,Soft athletic shirt with a flexible fit for strength training and cardio workouts.,32.99,true,T-Shirts
BodyEra Oversized Pump Cover,"Relaxed oversized shirt designed for warm-ups, lifting sessions, and casual wear.",39.99,true,T-Shirts
BodyEra Dry-Fit Logo Tee,Breathable quick-dry shirt featuring a clean BodyEra logo design.,36.99,true,T-Shirts
BodyEra Essential Everyday Tee,"Comfortable cotton-blend shirt suitable for training, travel, and daily use.",29.99,true,T-Shirts
BodyEra Compression Training Tee,Close-fitting performance shirt designed to support unrestricted movement.,42.99,true,T-Shirts
BodyEra Heritage Graphic Tee,Athletic lifestyle shirt featuring a bold BodyEra heritage graphic.,37.99,true,T-Shirts
BodyEra Minimal Logo Tee,Clean and versatile training shirt with a small chest logo.,31.99,true,T-Shirts
BodyEra Powerlifting Club Tee,Durable gym shirt inspired by strength training and powerlifting culture.,38.99,true,T-Shirts
BodyEra Velocity Training Tee,Lightweight performance top built for high-intensity workouts.,35.99,true,T-Shirts
BodyEra Classic BodyEra Tee,Signature BodyEra shirt with a comfortable athletic fit.,33.99,true,T-Shirts
BodyEra Recovery Day Tee,Soft relaxed-fit shirt designed for rest days and casual wear.,30.99,true,T-Shirts
BodyEra Strength Division Tee,Performance shirt featuring a strength-focused graphic design.,37.99,true,T-Shirts
BodyEra Athlete Series Tee,Versatile athletic shirt created for training and everyday performance.,36.99,true,T-Shirts
BodyEra Endurance Training Tee,Breathable workout shirt made for longer training sessions.,35.99,true,T-Shirts
BodyEra Founders Edition Tee,Limited-style shirt celebrating the launch of BodyEra Fitness.,41.99,true,T-Shirts
BodyEra Monochrome Logo Tee,Minimal black-and-white logo shirt with an athletic cut.,34.99,true,T-Shirts
BodyEra Heavyweight Training Tee,Thicker premium shirt designed for durability and structure.,44.99,true,T-Shirts
BodyEra Essential Pullover Hoodie,"Warm heavyweight pullover hoodie designed for training, travel, and recovery.",69.99,true,Hoodies
BodyEra Performance Zip Hoodie,Full-zip athletic hoodie with a comfortable and flexible fit.,74.99,true,Hoodies
BodyEra Oversized Training Hoodie,Relaxed oversized hoodie ideal for warm-ups and casual wear.,79.99,true,Hoodies
BodyEra Core Logo Hoodie,Classic BodyEra hoodie featuring a clean front logo.,67.99,true,Hoodies
BodyEra Heavyweight Pump Cover Hoodie,Premium heavyweight hoodie designed for strength training culture.,84.99,true,Hoodies
BodyEra Tech Fleece Hoodie,Lightweight insulated hoodie built for active movement and cooler weather.,89.99,true,Hoodies
BodyEra Strength Division Hoodie,Warm training hoodie featuring a bold strength-inspired design.,76.99,true,Hoodies
BodyEra Minimalist Zip Hoodie,Simple full-zip hoodie with subtle BodyEra branding.,72.99,true,Hoodies
BodyEra Recovery Pullover Hoodie,Soft relaxed-fit hoodie designed for rest days and travel.,71.99,true,Hoodies
BodyEra Athlete Series Hoodie,Versatile athletic hoodie designed for gym and everyday wear.,78.99,true,Hoodies
BodyEra Monochrome Logo Hoodie,Black-and-white branded hoodie with a clean modern look.,73.99,true,Hoodies
BodyEra Founders Edition Hoodie,Premium commemorative hoodie celebrating BodyEra Fitness.,92.99,true,Hoodies
BodyEra Warm-Up Hoodie,Comfortable midweight hoodie designed for pre-workout warm-ups.,68.99,true,Hoodies
BodyEra Heritage Graphic Hoodie,Lifestyle hoodie featuring a bold BodyEra heritage graphic.,81.99,true,Hoodies
BodyEra Performance Pullover Hoodie,Breathable athletic hoodie designed for movement and comfort.,75.99,true,Hoodies
BodyEra Classic BodyEra Hoodie,Signature branded hoodie with a timeless athletic design.,70.99,true,Hoodies
BodyEra Training Club Hoodie,Gym-focused hoodie inspired by team training and community.,77.99,true,Hoodies
BodyEra Premium Heavyweight Hoodie,Structured premium hoodie made with thick durable fabric.,94.99,true,Hoodies
BodyEra Essential Training Joggers,Comfortable tapered joggers designed for workouts and everyday wear.,59.99,true,Joggers
BodyEra Performance Tech Joggers,Flexible athletic joggers with a lightweight performance feel.,69.99,true,Joggers
BodyEra Classic Fleece Joggers,"Soft fleece joggers made for warm-ups, recovery, and casual use.",64.99,true,Joggers
BodyEra Slim Fit Gym Joggers,Tapered training pants designed for movement and a clean athletic fit.,62.99,true,Joggers
BodyEra Heavyweight Rest Day Joggers,Thick comfortable joggers built for colder days and recovery.,74.99,true,Joggers
BodyEra Core Logo Joggers,Classic joggers featuring subtle BodyEra branding.,61.99,true,Joggers
BodyEra Athlete Series Joggers,Versatile training joggers designed for active lifestyles.,68.99,true,Joggers
BodyEra Strength Division Joggers,Durable gym joggers inspired by strength training.,66.99,true,Joggers
BodyEra Tech Fleece Training Pants,Warm technical joggers with flexible construction.,79.99,true,Joggers
BodyEra Recovery Lounge Joggers,Relaxed-fit joggers made for comfort after training.,63.99,true,Joggers
BodyEra Monochrome Joggers,Minimal black-and-white athletic joggers with a tapered fit.,65.99,true,Joggers
BodyEra Performance Cargo Joggers,Athletic cargo-style joggers with added storage and mobility.,76.99,true,Joggers
BodyEra Warm-Up Track Joggers,Lightweight track-style pants made for warm-ups and cardio.,67.99,true,Joggers
BodyEra Premium Tapered Joggers,High-quality joggers featuring a structured athletic fit.,72.99,true,Joggers
BodyEra Everyday Training Joggers,"Versatile joggers suitable for training, travel, and daily wear.",60.99,true,Joggers
BodyEra Founders Edition Joggers,Limited-style premium joggers featuring BodyEra launch branding.,82.99,true,Joggers
BodyEra Endurance Track Pants,Breathable training pants designed for conditioning workouts.,69.99,true,Joggers
BodyEra Classic BodyEra Joggers,Signature tapered joggers with comfortable stretch fabric.,64.99,true,Joggers
BodyEra Performance Training Shorts,"Flexible athletic shorts designed for lifting, cardio, and everyday training.",44.99,true,Shorts
BodyEra Core Gym Shorts,Comfortable lightweight shorts made for general workouts.,39.99,true,Shorts
BodyEra Compression Lined Shorts,Training shorts with a supportive built-in compression liner.,54.99,true,Shorts
BodyEra Lightweight Running Shorts,Breathable shorts designed for running and conditioning.,42.99,true,Shorts
BodyEra Strength Division Shorts,Durable gym shorts inspired by strength training culture.,46.99,true,Shorts
BodyEra Essential Mesh Shorts,Breathable mesh shorts with a relaxed athletic fit.,41.99,true,Shorts
BodyEra Athlete Series Shorts,Versatile performance shorts built for a wide range of workouts.,48.99,true,Shorts
BodyEra Classic BodyEra Shorts,Signature athletic shorts with subtle BodyEra branding.,43.99,true,Shorts
BodyEra Training Club Shorts,Comfortable gym shorts designed for team and solo training.,45.99,true,Shorts
BodyEra Tech Performance Shorts,Quick-dry technical shorts made for high-intensity workouts.,49.99,true,Shorts
BodyEra Recovery Lounge Shorts,Soft casual shorts designed for rest days and light activity.,37.99,true,Shorts
BodyEra Monochrome Training Shorts,Minimal athletic shorts with a clean black-and-white design.,44.99,true,Shorts
BodyEra Powerlifting Shorts,Durable flexible shorts designed for squats and heavy lifting.,47.99,true,Shorts
BodyEra Endurance Shorts,Lightweight training shorts made for longer conditioning sessions.,45.99,true,Shorts
BodyEra Premium Training Shorts,High-quality athletic shorts with enhanced comfort and durability.,52.99,true,Shorts
BodyEra Founders Edition Shorts,Limited-style shorts celebrating the BodyEra launch.,56.99,true,Shorts
BodyEra Everyday Active Shorts,Versatile shorts suitable for workouts and casual wear.,40.99,true,Shorts
BodyEra Warm-Up Basketball Shorts,Relaxed longer-length shorts inspired by classic training gear.,46.99,true,Shorts
BodyEra Performance Training Tank,Lightweight tank top designed for unrestricted movement during workouts.,29.99,true,Tank Tops
BodyEra Classic Stringer Tank,Traditional gym stringer made for bodybuilding and strength training.,31.99,true,Tank Tops
BodyEra Essential Muscle Tank,Comfortable sleeveless shirt with a relaxed athletic fit.,32.99,true,Tank Tops
BodyEra Compression Tank,Close-fitting performance tank designed for training support.,38.99,true,Tank Tops
BodyEra Core Logo Tank,Simple gym tank featuring a clean BodyEra logo.,28.99,true,Tank Tops
BodyEra Athlete Series Tank,Versatile athletic tank designed for lifting and conditioning.,34.99,true,Tank Tops
BodyEra Strength Division Stringer,Bodybuilding-style stringer featuring a bold strength graphic.,35.99,true,Tank Tops
BodyEra Oversized Muscle Tank,Relaxed sleeveless top designed for warm-ups and casual wear.,36.99,true,Tank Tops
BodyEra Dry-Fit Training Tank,Quick-dry breathable tank built for high-intensity sessions.,33.99,true,Tank Tops
BodyEra Minimalist Gym Tank,Clean and simple training tank with subtle branding.,27.99,true,Tank Tops
BodyEra Founders Edition Tank,Limited-style tank celebrating the launch of BodyEra Fitness.,39.99,true,Tank Tops
BodyEra Endurance Tank,Lightweight athletic tank designed for longer cardio workouts.,32.99,true,Tank Tops
BodyEra Monochrome Stringer,Black-and-white bodybuilding stringer with a modern fit.,34.99,true,Tank Tops
BodyEra Classic BodyEra Tank,Signature sleeveless training top with an athletic cut.,30.99,true,Tank Tops
BodyEra Powerlifting Club Tank,Durable muscle tank inspired by powerlifting culture.,35.99,true,Tank Tops
BodyEra Recovery Day Tank,Soft casual tank designed for rest days and warm weather.,28.99,true,Tank Tops
BodyEra Premium Training Tank,High-quality performance tank with soft stretch fabric.,37.99,true,Tank Tops
BodyEra Heritage Graphic Tank,Lifestyle gym tank featuring a bold BodyEra graphic.,33.99,true,Tank Tops
BodyEra BodyEra Gym Bag,"Durable fitness bag with space for clothing, shoes, and accessories.",49.99,true,Accessories
BodyEra Stainless Steel Water Bottle,Reusable insulated water bottle designed for training and daily use.,29.99,true,Accessories
BodyEra Lifting Straps,Durable padded straps designed to improve grip during pulling exercises.,19.99,true,Accessories
BodyEra Wrist Wraps,Supportive wrist wraps designed for pressing and strength training.,24.99,true,Accessories
BodyEra Resistance Band Set,"Portable resistance bands for warm-ups, mobility, and home workouts.",34.99,true,Accessories
BodyEra BodyEra Training Cap,Adjustable athletic cap featuring the BodyEra logo.,27.99,true,Accessories
BodyEra Classic Snapback Hat,Structured snapback hat with embroidered BodyEra branding.,32.99,true,Accessories
BodyEra Gym Towel,Soft absorbent training towel designed for gym sessions.,17.99,true,Accessories
BodyEra Shaker Bottle,Leak-resistant shaker bottle for protein shakes and supplements.,16.99,true,Accessories
BodyEra Lifting Belt,Supportive training belt designed for squats and deadlifts.,59.99,true,Accessories
BodyEra Knee Sleeves,Compression knee sleeves designed to support heavy training.,44.99,true,Accessories
BodyEra Elbow Sleeves,Supportive compression sleeves for pressing and upper-body workouts.,39.99,true,Accessories
BodyEra Ankle Socks Three-Pack,Comfortable athletic ankle socks designed for training.,21.99,true,Accessories
BodyEra Crew Socks Three-Pack,Cushioned crew-length gym socks featuring BodyEra branding.,24.99,true,Accessories
BodyEra Training Backpack,Versatile athletic backpack with organized storage compartments.,64.99,true,Accessories
BodyEra Drawstring Gym Bag,Lightweight drawstring bag for carrying essential workout gear.,22.99,true,Accessories
BodyEra Foam Roller,Firm recovery roller designed for mobility and muscle relief.,36.99,true,Accessories
BodyEra Mini Resistance Bands,Compact loop-band set for glute activation and mobility work.,23.99,true,Accessories
